[
  {
    "$schema": "../../schemas/protocol.schema.json",
    "slug": "native-ms-metal-binding",
    "name": "Native MS metabolomics for metal-binding compounds",
    "aliases": [
      "Native spray metabolomics"
    ],
    "summary": "A transferable LC-MS strategy that combines post-column pH adjustment and metal infusion with ion identity molecular networking to discover small molecules that bind metals in complex biological samples.",
    "description": "This protocol adapts native electrospray concepts to metabolomics so that protonated and metal-bound forms of the same chromatographic analyte can be detected together. Post-column pH adjustment and infusion of a selected metal are coupled to feature processing and ion identity molecular networking, allowing candidate metal-binding molecules to be prioritized from characteristic mass offsets and shared chromatographic behavior.",
    "publication": {
      "title": "Native mass spectrometry-based metabolomics identifies metal-binding compounds",
      "doi": "10.1038/s41557-021-00803-1",
      "url": "https://www.nature.com/articles/s41557-021-00803-1",
      "citation": "Aron AT, Petras D, Schmid R, et al. Native mass spectrometry-based metabolomics identifies metal-binding compounds. Nature Chemistry 14, 100–109 (2022).",
      "journal": "Nature Chemistry",
      "year": 2022
    },
    "purpose": {
      "primary": "metal_binding",
      "secondary": [
        "native_metabolomics",
        "natural_product_discovery"
      ]
    },
    "platforms": [
      "lc_ms"
    ],
    "analysis_types": [
      "untargeted",
      "metabolite_profiling"
    ],
    "acquisition": {
      "ms_levels": [
        "ms1",
        "ms2"
      ],
      "strategies": [
        "full_scan",
        "dda",
        "native_esi"
      ],
      "ion_mobility": "not_required"
    },
    "sample_contexts": [
      "microbial",
      "marine",
      "environmental",
      "synthetic_standards"
    ],
    "components": [
      "chromatography",
      "post_column_modification",
      "data_acquisition",
      "preprocessing",
      "annotation",
      "molecular_networking",
      "data_sharing"
    ],
    "workflow_steps": [
      {
        "title": "Separate metabolites by LC",
        "description": "Analyze the extract using an LC-MS method suitable for retaining native-like metal-binding interactions after chromatographic separation."
      },
      {
        "title": "Adjust post-column pH",
        "description": "Infuse a volatile base or buffer after the LC column to establish conditions compatible with observing metal complexes during electrospray."
      },
      {
        "title": "Infuse the metal of interest",
        "description": "Introduce a metal salt post-column so protonated and metal-bound forms of candidate ligands can be observed with matched retention behavior."
      },
      {
        "title": "Process features and ion identities",
        "description": "Detect and align chromatographic features and group coeluting ion species with correlated peak shapes and expected mass relationships.",
        "tool_slugs": [
          "mzmine"
        ]
      },
      {
        "title": "Build an ion identity molecular network",
        "description": "Use ion identity molecular networking to connect ion species and spectral relationships, highlighting candidate metal-binding compounds.",
        "tool_slugs": [
          "mzmine",
          "gnps"
        ],
        "external_tools": [
          {
            "name": "Cytoscape",
            "url": "https://cytoscape.org/"
          }
        ]
      },
      {
        "title": "Prioritize and validate candidate binders",
        "description": "Interpret expected metal-adduct mass offsets, inspect spectra and chromatograms, and validate prioritized compounds with standards or orthogonal evidence where available."
      }
    ],
    "tools": [
      {
        "slug": "mzmine",
        "role": "Feature detection, ion grouping, and ion identity networking preparation."
      },
      {
        "slug": "gnps",
        "role": "Ion identity molecular networking and MS/MS-based network analysis."
      },
      {
        "slug": "massive",
        "role": "Public deposition and reuse of the study mass-spectrometry datasets."
      },
      {
        "name": "Cytoscape",
        "url": "https://cytoscape.org/",
        "role": "Optional network visualization."
      }
    ],
    "resources": {
      "raw_data_available": true,
      "raw_data_url": "https://massive.ucsd.edu/",
      "processed_data_available": true,
      "processed_data_url": "https://www.nature.com/articles/s41557-021-00803-1",
      "code_available": true,
      "code_url": "https://mzmine.github.io/iin_fbmn",
      "protocol_available": true,
      "protocol_url": "https://www.nature.com/articles/s41557-021-00803-1"
    },
    "scope": {
      "designed_for": [
        "Discovering metal-binding small molecules in complex extracts using standard LC-MS hardware with post-column modification.",
        "Comparing protonated and metal-bound ion species through chromatographic correlation and defined mass offsets."
      ],
      "requirements": [
        "LC-MS system with a post-column setup that permits pH adjustment and metal-salt infusion.",
        "Appropriate blanks and controls to distinguish biologically relevant complexes from background or source-derived adducts."
      ],
      "considerations": [
        "Metal identity, pH, salt concentration and electrospray conditions can alter complex formation and should be optimized and reported.",
        "The network highlights candidate binding behavior; structural identity and biological relevance require additional evidence."
      ]
    },
    "related_protocols": [],
    "provenance": {
      "submitted_by": "curator",
      "author_verified": false
    },
    "status": {
      "entry": "published",
      "review": "editorially_reviewed",
      "created_at": "2026-08-21",
      "updated_at": "2026-08-21",
      "last_verified": "2026-08-21",
      "last_editorial_review": "2026-08-21"
    }
  },
  {
    "$schema": "../../schemas/protocol.schema.json",
    "slug": "reverse-metabolomics",
    "name": "Reverse metabolomics",
    "summary": "A discovery strategy that starts from a candidate chemical structure or reference MS/MS spectrum, searches public metabolomics repositories for matching spectra, and uses sample metadata to reveal biological or phenotypic associations.",
    "description": "Reverse metabolomics reverses the usual untargeted workflow. Instead of starting with an unknown feature and attempting to infer its structure, the researcher begins with a candidate structure and an experimental MS/MS spectrum, searches public metabolomics data for matching spectra, and then uses repository metadata to ask where the molecule occurs. The resulting organism, biospecimen, phenotype or disease associations can guide biological validation.",
    "publication": {
      "title": "Reverse metabolomics for the discovery of chemical structures from humans",
      "doi": "10.1038/s41586-023-06906-8",
      "url": "https://www.nature.com/articles/s41586-023-06906-8",
      "citation": "Gentry EC, Collins SL, Panitchpakdi M, et al. Reverse metabolomics for the discovery of chemical structures from humans. Nature 626, 419–426 (2024).",
      "journal": "Nature",
      "year": 2024
    },
    "purpose": {
      "primary": "reverse_metabolomics",
      "secondary": [
        "phenotype_association",
        "molecular_discovery",
        "metabolite_annotation"
      ]
    },
    "platforms": [
      "lc_ms"
    ],
    "analysis_types": [
      "untargeted",
      "metabolite_profiling"
    ],
    "acquisition": {
      "ms_levels": [
        "ms2"
      ],
      "strategies": [
        "dda",
        "targeted_msms",
        "flow_injection"
      ],
      "ion_mobility": "not_required"
    },
    "sample_contexts": [
      "human",
      "microbial",
      "synthetic_standards",
      "other"
    ],
    "components": [
      "data_acquisition",
      "spectral_search",
      "repository_mining",
      "metadata_analysis",
      "biological_validation",
      "data_sharing"
    ],
    "workflow_steps": [
      {
        "title": "Generate or obtain a reference MS/MS spectrum",
        "description": "Acquire tandem mass spectra for a candidate chemical structure, for example from a synthesized standard, authenticated standard, or suitable reference source.",
        "tool_slugs": [
          "msms-chooser"
        ]
      },
      {
        "title": "Select a representative reference spectrum",
        "description": "When standards are analyzed in mixtures, automatically select the MS/MS scan associated with the expected precursor and review the spectrum before repository searching.",
        "tool_slugs": [
          "msms-chooser"
        ]
      },
      {
        "title": "Search public MS/MS data",
        "description": "Use the reference spectrum as a query against public metabolomics datasets to identify files and datasets containing related spectra.",
        "tool_slugs": [
          "masst",
          "gnps",
          "massive"
        ]
      },
      {
        "title": "Contextualize matches with sample metadata",
        "description": "Summarize organism, biospecimen, phenotype, disease state and other standardized metadata associated with matching public files.",
        "tool_slugs": [
          "redu"
        ]
      },
      {
        "title": "Prioritize biological associations",
        "description": "Use the distribution of matched spectra across public datasets to generate hypotheses about where the molecule occurs and which phenotypes or sample types it may be associated with."
      },
      {
        "title": "Validate prioritized associations",